### ISSUE TITLE
Connecting with Grafana service results in `error: lost connection to pod` when port-forwarding to ingress controller

### ISSUE THREAD

**Issue by rzetelskik** [scylladb/scylla-operator#1229]
**Describe the bug**
When port-forwarding (`kubectl port-forward`) to ingress controller, trying to connect to Grafana service with an ingress defined results in error `error: lost connection to pod`.

**To Reproduce**
1. Deploy Scylla Operator, Prometheus Operator, HAproxy ingress controller and their dependencies
2. Deploy an example ScyllaDBMonitoring with Prometheus and Grafana configured
3. Port-forward to to the ingress controller service (`kubectl -n=haproxy-ingress port-forward services/haproxy-ingress 5000:443`)
5. Run `curl --fail -I -L --cacert <( echo "${GRAFANA_SERVING_CERT}" ) "https://test-grafana.test.svc.cluster.local:5000" --resolve "test-grafana.test.svc.cluster.local:5000:127.0.0.1" --user "${GRAFANA_USER}:${GRAFANA_PASSWORD}" -v --http1.1`

`curl` output:
```
* Added test-grafana.test.svc.cluster.local:5000:127.0.0.1 to DNS cache
* Hostname test-grafana.test.svc.cluster.local was found in DNS cache
*   Trying 127.0.0.1:5000...
* Connected to test-grafana.test.svc.cluster.local (127.0.0.1) port 5000 (#0)
* ALPN: offers http/1.1
* TLSv1.3 (OUT), TLS handshake, Client hello (1):
*  CAfile: /proc/self/fd/11
*  CApath: none
* OpenSSL SSL_connect: SSL_ERROR_SYSCALL in connection to test-grafana.test.svc.cluster.local:5000
* Closing connection 0
curl: (35) OpenSSL SSL_connect: SSL_ERROR_SYSCALL in connection to test-grafana.test.svc.cluster.local:5000
```

`kubectl port-forward` output
```
Forwarding from 127.0.0.1:5000 -> 8443
Forwarding from [::1]:5000 -> 8443
Handling connection for 5000
E0509 10:58:48.623744   62065 portforward.go:409] an error occurred forwarding 5000 -> 8443: error forwarding port 8443 to pod 2e5ed04cd6cbde44a29e725022a1844602f4bd4cdb713ae0366425174326f56f, uid : failed to execute portforward in network namespace "/var/run/netns/cni-8f798f29-236b-b5c2-5d8f-7380bd91a44c": read tcp4 127.0.0.1:50692->127.0.0.1:8443: read: connection reset by peer
error: lost connection to pod
```

**Expected behavior**
Grafana should be reached through haproxy and return status code 200. `kubectl port-forward` should not terminate with an error.

**Additional context**
Refer to https://operator.docs.scylladb.com/master/monitoring.html for instructions on how to get the credentials and certs for Grafana.

**Comment by rzetelskik** [comment]
```
$ openssl s_client -showcerts -connect "127.0.0.1:5000" -servername test-grafana.test.svc.cluster.local -CAfile <( echo "${GRAFANA_SERVING_CERT}" ) -state -debug

40FC522D297F0000:error:8000006F:system library:BIO_connect:Connection refused:crypto/bio/bio_sock2.c:114:calling connect()
40FC522D297F0000:error:10000067:BIO routines:BIO_connect:connect error:crypto/bio/bio_sock2.c:116:
connect:errno=111
(⎈ |minikube:haproxy-ingress)➜  scylla-operator git:(master) ✗
(⎈ |minikube:haproxy-ingress)➜  scylla-operator git:(master) ✗ openssl s_client -showcerts -connect "${INGRESS_IP}:${INGRESS_PORT}" -servername test-grafana.test.svc.cluster.local -CAfile <( echo "${GRAFANA_SERVING_CERT}" ) -state -debug
CONNECTED(00000003)
SSL_connect:before SSL initialization
write to 0x56416fe49b40 [0x56416fe63b60] (339 bytes => 339 (0x153))
0000 - 16 03 01 01 4e 01 00 01-4a 03 03 d7 14 12 c3 cc   ....N...J.......
0010 - 42 47 09 ab 4f 00 9a d0-8f 25 67 c3 08 79 b8 78   BG..O....%g..y.x
0020 - a5 f8 31 58 bd 07 02 ef-e8 73 0c 20 9a 69 d0 85   ..1X.....s. .i..
0030 - 05 ae bf ad 78 6e b6 27-6e 45 58 b4 f0 6c a6 9c   ....xn.'nEX..l..
0040 - 2f 7f 86 76 80 11 c1 a0-89 8e 60 73 00 48 13 02   /..v......`s.H..
0050 - 13 03 13 01 13 04 c0 2c-c0 30 cc a9 cc a8 c0 ad   .......,.0......
0060 - c0 2b c0 2f c0 ac c0 23-c0 27 c0 0a c0 14 c0 09   .+./...#.'......
0070 - c0 13 00 9d c0 9d 00 9c-c0 9c 00 3d 00 3c 00 35   ...........=.<.5
0080 - 00 2f 00 9f cc aa c0 9f-00 9e c0 9e 00 6b 00 67   ./...........k.g
0090 - 00 39 00 33 00 ff 01 00-00 b9 00 00 00 28 00 26   .9.3.........(.&
00a0 - 00 00 23 74 65 73 74 2d-67 72 61 66 61 6e 61 2e   ..#test-grafana.
00b0 - 74 65 73 74 2e 73 76 63-2e 63 6c 75 73 74 65 72   test.svc.cluster
00c0 - 2e 6c 6f 63 61 6c 00 0b-00 04 03 00 01 02 00 0a   .local..........
00d0 - 00 16 00 14 00 1d 00 17-00 1e 00 19 00 18 01 00   ................
00e0 - 01 01 01 02 01 03 01 04-00 23 00 00 00 16 00 00   .........#......
00f0 - 00 17 00 00 00 0d 00 22-00 20 04 03 05 03 06 03   .......". ......
0100 - 08 07 08 08 08 09 08 0a-08 0b 08 04 08 05 08 06   ................
0110 - 04 01 05 01 06 01 03 03-03 01 00 2b 00 05 04 03   ...........+....
0120 - 04 03 03 00 2d 00 02 01-01 00 33 00 26 00 24 00   ....-.....3.&.$.
0130 - 1d 00 20 df 71 d2 25 25-80 a7 c0 27 a2 1b 1f 0a   .. .q.%%...'....
0140 - 6d e8 42 b3 5f 49 97 f9-02 a3 75 30 5a c6 3a b3   m.B._I....u0Z.:.
0150 - c1 f8 74                                          ..t
SSL_connect:SSLv3/TLS write client hello
read from 0x56416fe49b40 [0x56416fe5a933] (5 bytes => 0)
write to 0x56416fe49b40 [0x56416fe63b60] (7 bytes => 7 (0x7))
0000 - 15 03 01 00 02 02 32                              ......2
SSL3 alert write:fatal:decode error
SSL_connect:error in error
402C13D3EC7F0000:error:0A000126:SSL routines:ssl3_read_n:unexpected eof while reading:ssl/record/rec_layer_s3.c:321:
---
no peer certificate available
---
No client certificate CA names sent
---
SSL handshake has read 0 bytes and written 346 bytes
Verification: OK
---
New, (NONE), Cipher is (NONE)
Secure Renegotiation IS NOT supported
Compression: NONE
Expansion: NONE
No ALPN negotiated
Early data was not sent
Verify return code: 0 (ok)
---
read from 0x56416fe49b40 [0x56416fe0a720] (8192 bytes => 0)
```

```
$ kubectl -n=haproxy-ingress port-forward services/haproxy-ingress 5000:443

Forwarding from 127.0.0.1:5000 -> 8443
Forwarding from [::1]:5000 -> 8443
Handling connection for 5000
E0509 11:00:33.365583   63214 portforward.go:409] an error occurred forwarding 5000 -> 8443: error forwarding port 8443 to pod 2e5ed04cd6cbde44a29e725022a1844602f4bd4cdb713ae0366425174326f56f, uid : failed to execute portforward in network namespace "/var/run/netns/cni-8f798f29-236b-b5c2-5d8f-7380bd91a44c": read tcp4 127.0.0.1:52012->127.0.0.1:8443: read: connection reset by peer
error: lost connection to pod
```

Wireshark dump:
```
No.     Time           Source                Destination           Dest port Protocol Length Info
      1 0.000000000    127.0.0.1             127.0.0.1             5000      TCP      74     34890 → 5000 [SYN] Seq=0 Win=65495 Len=0 MSS=65495 SACK_PERM TSval=1619292859 TSecr=0 WS=128

Frame 1: 74 bytes on wire (592 bits), 74 bytes captured (592 bits) on interface lo, id 0
Ethernet II, Src: 00:00:00_00:00:00 (00:00:00:00:00:00), Dst: 00:00:00_00:00:00 (00:00:00:00:00:00)
Internet Protocol Version 4, Src: 127.0.0.1, Dst: 127.0.0.1
Transmission Control Protocol, Src Port: 34890, Dst Port: 5000, Seq: 0, Len: 0
    Source Port: 34890
    Destination Port: 5000
    [Stream index: 0]
    [Conversation completeness: Complete, WITH_DATA (63)]
    [TCP Segment Len: 0]
    Sequence Number: 0    (relative sequence number)
    Sequence Number (raw): 713891909
    [Next Sequence Number: 1    (relative sequence number)]
    Acknowledgment Number: 0
    Acknowledgment number (raw): 0
    1010 .... = Header Length: 40 bytes (10)
    Flags: 0x002 (SYN)
    Window: 65495
    [Calculated window size: 65495]
    Checksum: 0xfe30 [unverified]
    [Checksum Status: Unverified]
    Urgent Pointer: 0
    Options: (20 bytes), Maximum segment size, SACK permitted, Timestamps, No-Operation (NOP), Window scale
    [Timestamps]

No.     Time           Source                Destination           Dest port Protocol Length Info
      2 0.000022921    127.0.0.1             127.0.0.1             34890     TCP      74     5000 → 34890 [SYN, ACK] Seq=0 Ack=1 Win=65483 Len=0 MSS=65495 SACK_PERM TSval=1619292859 TSecr=1619292859 WS=128

Frame 2: 74 bytes on wire (592 bits), 74 bytes captured (592 bits) on interface lo, id 0
Ethernet II, Src: 00:00:00_00:00:00 (00:00:00:00:00:00), Dst: 00:00:00_00:00:00 (00:00:00:00:00:00)
Internet Protocol Version 4, Src: 127.0.0.1, Dst: 127.0.0.1
Transmission Control Protocol, Src Port: 5000, Dst Port: 34890, Seq: 0, Ack: 1, Len: 0
    Source Port: 5000
    Destination Port: 34890
    [Stream index: 0]
    [Conversation completeness: Complete, WITH_DATA (63)]
    [TCP Segment Len: 0]
    Sequence Number: 0    (relative sequence number)
    Sequence Number (raw): 2614268122
    [Next Sequence Number: 1    (relative sequence number)]
    Acknowledgment Number: 1    (relative ack number)
    Acknowledgment number (raw): 713891910
    1010 .... = Header Length: 40 bytes (10)
    Flags: 0x012 (SYN, ACK)
    Window: 65483
    [Calculated window size: 65483]
    Checksum: 0xfe30 [unverified]
    [Checksum Status: Unverified]
    Urgent Pointer: 0
    Options: (20 bytes), Maximum segment size, SACK permitted, Timestamps, No-Operation (NOP), Window scale
    [Timestamps]
    [SEQ/ACK analysis]

No.     Time           Source                Destination           Dest port Protocol Length Info
      3 0.000039391    127.0.0.1             127.0.0.1             5000      TCP      66     34890 → 5000 [ACK] Seq=1 Ack=1 Win=65536 Len=0 TSval=1619292859 TSecr=1619292859

Frame 3: 66 bytes on wire (528 bits), 66 bytes captured (528 bits) on interface lo, id 0
Ethernet II, Src: 00:00:00_00:00:00 (00:00:00:00:00:00), Dst: 00:00:00_00:00:00 (00:00:00:00:00:00)
Internet Protocol Version 4, Src: 127.0.0.1, Dst: 127.0.0.1
Transmission Control Protocol, Src Port: 34890, Dst Port: 5000, Seq: 1, Ack: 1, Len: 0
    Source Port: 34890
    Destination Port: 5000
    [Stream index: 0]
    [Conversation completeness: Complete, WITH_DATA (63)]
    [TCP Segment Len: 0]
    Sequence Number: 1    (relative sequence number)
    Sequence Number (raw): 713891910
    [Next Sequence Number: 1    (relative sequence number)]
    Acknowledgment Number: 1    (relative ack number)
    Acknowledgment number (raw): 2614268123
    1000 .... = Header Length: 32 bytes (8)
    Flags: 0x010 (ACK)
    Window: 512
    [Calculated window size: 65536]
    [Window size scaling factor: 128]
    Checksum: 0xfe28 [unverified]
    [Checksum Status: Unverified]
    Urgent Pointer: 0
    Options: (12 bytes), No-Operation (NOP), No-Operation (NOP), Timestamps
    [Timestamps]
    [SEQ/ACK analysis]

No.     Time           Source                Destination           Dest port Protocol Length Info
      4 0.001409252    127.0.0.1             127.0.0.1             5000      RSL      405    unknown 78

Frame 4: 405 bytes on wire (3240 bits), 405 bytes captured (3240 bits) on interface lo, id 0
Ethernet II, Src: 00:00:00_00:00:00 (00:00:00:00:00:00), Dst: 00:00:00_00:00:00 (00:00:00:00:00:00)
Internet Protocol Version 4, Src: 127.0.0.1, Dst: 127.0.0.1
Transmission Control Protocol, Src Port: 34890, Dst Port: 5000, Seq: 1, Ack: 1, Len: 339
    Source Port: 34890
    Destination Port: 5000
    [Stream index: 0]
    [Conversation completeness: Complete, WITH_DATA (63)]
    [TCP Segment Len: 339]
    Sequence Number: 1    (relative sequence number)
    Sequence Number (raw): 713891910
    [Next Sequence Number: 340    (relative sequence number)]
    Acknowledgment Number: 1    (relative ack number)
    Acknowledgment number (raw): 2614268123
    1000 .... = Header Length: 32 bytes (8)
    Flags: 0x018 (PSH, ACK)
    Window: 512
    [Calculated window size: 65536]
    [Window size scaling factor: 128]
    Checksum: 0xff7b [unverified]
    [Checksum Status: Unverified]
    Urgent Pointer: 0
    Options: (12 bytes), No-Operation (NOP), No-Operation (NOP), Timestamps
    [Timestamps]
    [SEQ/ACK analysis]
    TCP payload (339 bytes)
IPA protocol ip.access, type: unknown 0x01
    DataLen: 5635
    Protocol: Unknown (0x01)
Radio Signalling Link (RSL)
    0000 000. = Message discriminator: Reserved (0)
    .... ...1 = T bit: Considered transparent by BTS
    .100 1110 = Message type: Unknown (0x4e)

No.     Time           Source                Destination           Dest port Protocol Length Info
      5 0.001423472    127.0.0.1             127.0.0.1             34890     TCP      66     5000 → 34890 [ACK] Seq=1 Ack=340 Win=65152 Len=0 TSval=1619292861 TSecr=1619292861

Frame 5: 66 bytes on wire (528 bits), 66 bytes captured (528 bits) on interface lo, id 0
Ethernet II, Src: 00:00:00_00:00:00 (00:00:00:00:00:00), Dst: 00:00:00_00:00:00 (00:00:00:00:00:00)
Internet Protocol Version 4, Src: 127.0.0.1, Dst: 127.0.0.1
Transmission Control Protocol, Src Port: 5000, Dst Port: 34890, Seq: 1, Ack: 340, Len: 0
    Source Port: 5000
    Destination Port: 34890
    [Stream index: 0]
    [Conversation completeness: Complete, WITH_DATA (63)]
    [TCP Segment Len: 0]
    Sequence Number: 1    (relative sequence number)
    Sequence Number (raw): 2614268123
    [Next Sequence Number: 1    (relative sequence number)]
    Acknowledgment Number: 340    (relative ack number)
    Acknowledgment number (raw): 713892249
    1000 .... = Header Length: 32 bytes (8)
    Flags: 0x010 (ACK)
    Window: 509
    [Calculated window size: 65152]
    [Window size scaling factor: 128]
    Checksum: 0xfe28 [unverified]
    [Checksum Status: Unverified]
    Urgent Pointer: 0
    Options: (12 bytes), No-Operation (NOP), No-Operation (NOP), Timestamps
    [Timestamps]
    [SEQ/ACK analysis]

No.     Time           Source                Destination           Dest port Protocol Length Info
      6 1.008004559    127.0.0.1             127.0.0.1             34890     TCP      66     5000 → 34890 [FIN, ACK] Seq=1 Ack=340 Win=65536 Len=0 TSval=1619293867 TSecr=1619292861

Frame 6: 66 bytes on wire (528 bits), 66 bytes captured (528 bits) on interface lo, id 0
Ethernet II, Src: 00:00:00_00:00:00 (00:00:00:00:00:00), Dst: 00:00:00_00:00:00 (00:00:00:00:00:00)
Internet Protocol Version 4, Src: 127.0.0.1, Dst: 127.0.0.1
Transmission Control Protocol, Src Port: 5000, Dst Port: 34890, Seq: 1, Ack: 340, Len: 0
    Source Port: 5000
    Destination Port: 34890
    [Stream index: 0]
    [Conversation completeness: Complete, WITH_DATA (63)]
    [TCP Segment Len: 0]
    Sequence Number: 1    (relative sequence number)
    Sequence Number (raw): 2614268123
    [Next Sequence Number: 2    (relative sequence number)]
    Acknowledgment Number: 340    (relative ack number)
    Acknowledgment number (raw): 713892249
    1000 .... = Header Length: 32 bytes (8)
    Flags: 0x011 (FIN, ACK)
    Window: 512
    [Calculated window size: 65536]
    [Window size scaling factor: 128]
    Checksum: 0xfe28 [unverified]
    [Checksum Status: Unverified]
    Urgent Pointer: 0
    Options: (12 bytes), No-Operation (NOP), No-Operation (NOP), Timestamps
    [Timestamps]

No.     Time           Source                Destination           Dest port Protocol Length Info
      7 1.008109992    127.0.0.1             127.0.0.1             5000      TCP      66     34890 → 5000 [ACK] Seq=340 Ack=2 Win=65536 Len=0 TSval=1619293867 TSecr=1619293867

Frame 7: 66 bytes on wire (528 bits), 66 bytes captured (528 bits) on interface lo, id 0
Ethernet II, Src: 00:00:00_00:00:00 (00:00:00:00:00:00), Dst: 00:00:00_00:00:00 (00:00:00:00:00:00)
Internet Protocol Version 4, Src: 127.0.0.1, Dst: 127.0.0.1
Transmission Control Protocol, Src Port: 34890, Dst Port: 5000, Seq: 340, Ack: 2, Len: 0
    Source Port: 34890
    Destination Port: 5000
    [Stream index: 0]
    [Conversation completeness: Complete, WITH_DATA (63)]
    [TCP Segment Len: 0]
    Sequence Number: 340    (relative sequence number)
    Sequence Number (raw): 713892249
    [Next Sequence Number: 340    (relative sequence number)]
    Acknowledgment Number: 2    (relative ack number)
    Acknowledgment number (raw): 2614268124
    1000 .... = Header Length: 32 bytes (8)
    Flags: 0x010 (ACK)
    Window: 512
    [Calculated window size: 65536]
    [Window size scaling factor: 128]
    Checksum: 0xfe28 [unverified]
    [Checksum Status: Unverified]
    Urgent Pointer: 0
    Options: (12 bytes), No-Operation (NOP), No-Operation (NOP), Timestamps
    [Timestamps]
    [SEQ/ACK analysis]

No.     Time           Source                Destination           Dest port Protocol Length Info
      8 1.008223917    127.0.0.1             127.0.0.1             5000      RSL      73     DATA INDication [Malformed Packet: length of contained item exceeds length of containing item]

Frame 8: 73 bytes on wire (584 bits), 73 bytes captured (584 bits) on interface lo, id 0
Ethernet II, Src: 00:00:00_00:00:00 (00:00:00:00:00:00), Dst: 00:00:00_00:00:00 (00:00:00:00:00:00)
Internet Protocol Version 4, Src: 127.0.0.1, Dst: 127.0.0.1
Transmission Control Protocol, Src Port: 34890, Dst Port: 5000, Seq: 340, Ack: 2, Len: 7
    Source Port: 34890
    Destination Port: 5000
    [Stream index: 0]
    [Conversation completeness: Complete, WITH_DATA (63)]
    [TCP Segment Len: 7]
    Sequence Number: 340    (relative sequence number)
    Sequence Number (raw): 713892249
    [Next Sequence Number: 347    (relative sequence number)]
    Acknowledgment Number: 2    (relative ack number)
    Acknowledgment number (raw): 2614268124
    1000 .... = Header Length: 32 bytes (8)
    Flags: 0x018 (PSH, ACK)
    Window: 512
    [Calculated window size: 65536]
    [Window size scaling factor: 128]
    Checksum: 0xfe2f [unverified]
    [Checksum Status: Unverified]
    Urgent Pointer: 0
    Options: (12 bytes), No-Operation (NOP), No-Operation (NOP), Timestamps
    [Timestamps]
    [SEQ/ACK analysis]
    TCP payload (7 bytes)
IPA protocol ip.access, type: unknown 0x01
    DataLen: 5379
    Protocol: Unknown (0x01)
Radio Signalling Link (RSL)
    0000 000. = Message discriminator: Reserved (0)
    .... ...0 = T bit: Not considered transparent by BTS
    .000 0010 = Message type: DATA INDication (0x02)
    Channel number IE
[Malformed Packet: RSL: length of contained item exceeds length of containing item]

No.     Time           Source                Destination           Dest port Protocol Length Info
      9 1.008262645    127.0.0.1             127.0.0.1             34890     TCP      54     5000 → 34890 [RST] Seq=2 Win=0 Len=0

Frame 9: 54 bytes on wire (432 bits), 54 bytes captured (432 bits) on interface lo, id 0
Ethernet II, Src: 00:00:00_00:00:00 (00:00:00:00:00:00), Dst: 00:00:00_00:00:00 (00:00:00:00:00:00)
Internet Protocol Version 4, Src: 127.0.0.1, Dst: 127.0.0.1
Transmission Control Protocol, Src Port: 5000, Dst Port: 34890, Seq: 2, Len: 0
    Source Port: 5000
    Destination Port: 34890
    [Stream index: 0]
    [Conversation completeness: Complete, WITH_DATA (63)]
    [TCP Segment Len: 0]
    Sequence Number: 2    (relative sequence number)
    Sequence Number (raw): 2614268124
    [Next Sequence Number: 2    (relative sequence number)]
    Acknowledgment Number: 0
    Acknowledgment number (raw): 0
    0101 .... = Header Length: 20 bytes (5)
    Flags: 0x004 (RST)
    Window: 0
    [Calculated window size: 0]
    [Window size scaling factor: 128]
    Checksum: 0xe95c [unverified]
    [Checksum Status: Unverified]
    Urgent Pointer: 0
    [Timestamps]
```

**Comment by tnozicka** [comment]
Thanks for taking it this far! We have synced offline and decided not to pursue this further given the size of the time investment needed and our priorities at this point.
